,Datetime,Tweet Id,Text,Username
1039,2014-04-24 19:34:07+00:00,459415005608566784,Our developed model for determining the #Naira value of employees can be used across board for any organisation who cares to put Naira to...,LIMBsimple
1040,2014-04-24 19:32:48+00:00,459414672895377408,Determining the #Naira value for employees started as a need for one of our clients from the Engineering/ProjectMgt sector. However...,LIMBsimple
1041,2014-04-24 19:28:51+00:00,459413678874701824,Developing models for mathematically determining the #Naira value of employees. Now organisations can know who's valuable and who isn't.,LIMBsimple
1042,2014-04-24 19:26:20+00:00,459413046012948481,"So I've been quite busy working on building the right HR strategy for my clients
Nw we're looking at determining d #Naira value of employees",LIMBsimple
1043,2014-04-24 15:05:32+00:00,459347414303133696,@boasonbusiness @TunjiAndrews @proshare the value of the Naira fell south by 100%...M2 (broad money) up 210%...backlogs of salaries paid .,lloydatiku
1044,2014-04-21 21:21:42+00:00,458354917422686208,"@kafzy trust you can have 5 meals with 500 Naira
But in terms of ""Value"" £2 would be worth more",NeroTheCurator
1045,2014-04-21 21:20:13+00:00,458354543743737856,@OluseyiSTN 👍 2 pounds will just buy a tesco sandwich but more in Naira but it's opposite in terms of face value http://t.co/ARrkgr3jaI,kafzy
1046,2014-04-21 10:38:42+00:00,458193101740572672,How can my girl say naira marley is a tesco value version of chief keef noo I'm deaaaad,tashhinds
1047,2014-04-21 08:13:26+00:00,458156541120487426,The value of the average Nigerian life has plummeted like the Naira against the Dollar.,DIPMED1
1048,2014-04-21 07:07:02+00:00,458139831202488320,"@nighealthwatch my brother, the value of the average Nigerian life has plummeted like the Naira against the Dollar.",saratu
1049,2014-04-20 17:55:24+00:00,457940611841413122,@omannaji1 u can report to efcc if the value invlove million of naira,lekky29
1050,2014-04-17 18:47:00+00:00,456866434824409089,Naira's value has dwindled to d core...tens of thousands cn hardly buy items dat wl fill a polythene bag #o_su_mi,itz__breezy
1051,2014-04-17 13:16:44+00:00,456783320466989058,@CFiJAMSummit @ cfixpansion nobody would pay you one million naira if he or she has not seen value in your business.,sobafemi
1052,2014-04-16 12:24:06+00:00,456407686020472832,Solve dis ... ; Given that ur X -boyfriend won 10million naira in d who wants to be a millionaire show... find d value of X,dammykizz_
1053,2014-04-15 14:48:14+00:00,456081567849656320,These days I tend to value money more than people cos I avnt seen a naira or a dollar that I didn't like,SureMoi
1054,2014-04-15 13:24:10+00:00,456060414087143424,The value of a thousand naira drops by the second these days...#NoPretence,Acegrp01
1055,2014-04-14 18:08:04+00:00,455769469743562752,@Oritsega *yes it is...lol...saves you the stress of piracy ;-) 15 trial first then monthly 800+ naira gives so much value*,spicygbemi
1056,2014-04-13 23:36:24+00:00,455489713508712448,The Muslim/Muslim ticket was okay n ideal back in d day n so shall it be t'day is like forcing value between d present day Naira n Dollar!,obi_kk
1057,2014-04-12 20:00:41+00:00,455073038368006144,@renoomokri Let them also rebase the Naira whose value will impact on all Nigerians,atiegoba
1058,2014-04-12 18:39:18+00:00,455052558068097024,"@Abuja_Facts @scarfizal That 500m naira house does not know it's owner. When d owner dies,d house will shed no tears. We value d valueless",TruthProponent
1059,2014-04-12 16:31:30+00:00,455020396174393344,@chaplinez70 Arsenal just de drop for EPL like the value of Naira notes in Foreign trade*ROTFL*,dheley87
1060,2014-04-10 17:13:52+00:00,454306278580686848,LMFAoOo =)) RT @MusadiqZ: Dawisu dai tsoho ne. Akkalla ya kai 49. He started balling when the naira still had value,dawisu
1061,2014-04-10 16:58:45+00:00,454302475542355968,"Oga kaima ka doshi 30 ai""@MusadiqZ: Dawisu dai tsoho ne. Akkalla ya kai 49. He started balling when the naira still had value""",mr_dutsi
1062,2014-04-10 16:56:04+00:00,454301799055626240,“@MusadiqZ: Dawisu dai tsoho ne. Akkalla ya kai 49. He started balling when the naira still had value” wallahi fa! N800 buffet?!,LawalAbubakar_
1063,2014-04-10 16:51:45+00:00,454300714638917632,Dawisu dai tsoho ne. Akkalla ya kai 49. He started balling when the naira still had value,MusadiqZ
1064,2014-04-10 13:30:11+00:00,454249990387675136,There is daily economic value of 5million naira a day generated from  waste sorting @tundefashola #ehingbeti2014,ehingbeti
1065,2014-04-10 06:54:01+00:00,454150288396783616,@Im_a_MARVEL @gtbank U'll have to add the equivalent naira value of amount charged to 'certain cross border charges' and in some cases tax,tolsbee
1066,2014-04-09 22:27:07+00:00,454022725859049473,"@GbemiEreku Boss, Cedis and Naira, which has more value?",PaoloAbamwa
1067,2014-04-09 22:23:37+00:00,454021845193613312,@paolokonqueror  Really I can't argue with you. You are saying rubbish. Where has it bEen hrd dat cedi has more value dan naira?,coko_channel
1068,2014-04-09 22:05:57+00:00,454017398723842048,"@coko_channel No you google it, Cedis is of more value than NAIRA, dont argue.",PaoloAbamwa
1069,2014-04-09 17:24:09+00:00,453946480769130496,@duna_geidam thanks a lot but how sad for us no value for the naira,SassySwill
1070,2014-04-09 15:07:36+00:00,453912114672185344,#AbujarocksTop10Myths 1: Money is everything...will you take a naira over a dollar? Value is everything. Upgrade ur values today.,Abujarockz
1071,2014-04-09 14:50:29+00:00,453907808514482176,"""@Channels_TV: Nigerian Senate Passes 4.6 Trillion Naira 2014 Budget http://t.co/Obpnb6NPa8""# does de budget add any value to de masses ? NO",bizzite
1072,2014-04-09 12:08:22+00:00,453867009726771200,Well both of them value pass u RT @Etiks89:How does dt affect d value of d naira???RT @itsurboygaffy: Pixie and lamar http://t.co/AJixK9jxSC,itsurboygaffy
1073,2014-04-09 11:58:47+00:00,453864598417182720,How does dt affect d value of d naira???RT @itsurboygaffy: Pixie and lamar http://t.co/Y0VuJjWZbO,elhadj_pablo
1074,2014-04-09 09:26:20+00:00,453826233500180480,Where are we headed? Chai 1k Naira has no value at all. http://t.co/xjtVdCHa7R,YusufTAbubakar
1075,2014-04-07 17:54:13+00:00,453229273072275457,"Selling point value increase - 2,000 naira + La Casera ""@Harbeeola08: Awwwwww my ass don dey big -____-""""",iamHighDee
1076,2014-04-07 08:04:26+00:00,453080848276144129,"Poor road infrastructure, portable water is a farce, No security, Electricity is fairy tale, Foreign Exchange/Value of the Naira a dream...",YUGEEBAMIDELE
1077,2014-04-06 21:09:29+00:00,452916022048485376,"@eloka51 @DoubleEph @IamSnazz Right, that the Naira is almost 300 to £1 should definitely reflect well on the value of Nollywood.",AfroVII
1078,2014-04-06 14:42:52+00:00,452818727604875264,I saw the Naira collapse in 1986 with the realisation that we probably had nothing underpinning the artificial value of the currency.,forakin
1079,2014-04-06 14:39:49+00:00,452817960097579009,"@akaebube Congrats bro we can now borrow more. Meanwhile Naira dey lose value, no fuel,  more spent on diesel.  Wetin I get 2 b happy about?",Beardedheretic
1080,2014-04-05 19:58:18+00:00,452535722596380672,@baasaleh But rebasing has not improved the value of the naira. there are a lot of factors that will come into play.,omoaye1
1081,2014-04-05 09:12:18+00:00,452373149402005504,U cnt hold me lyk a pinch of SALT n xpect me to carry u lyk a bag of RICE.......Value z reciprocal,Tee_Naira
1082,2014-04-04 18:31:07+00:00,452151394988879872,Lower Naira value could hurt #Heineken in Nigeria.   http://t.co/Tlo9lR7bY7,WuishiDike
1083,2014-04-04 18:07:09+00:00,452145363873726464,"He should have pledged to value Naira @daily_trust Emefiele pledges to be firm in #CBN http://t.co/DrpS3IFFZt""",mustaphahodio
1084,2014-04-04 16:47:08+00:00,452125226516877312,@obyezeks @Nedunaija Zambia rebased it's economy and the value of their currency is higher than South African Rand &amp; our dear Naira,baasaleh
1085,2014-04-02 21:38:52+00:00,451473866016423937,Inflows from Oil Company dollars coupled with the RDAS auction held by the CBN earlier today boosted the value of the Naira. #Nigeria,ogus
1086,2014-04-01 15:32:33+00:00,451019292637945856,"In Naira that would be approximately  ₦268,800. 00. That's not much though. Measured in cocain value, I was told it's worth 23.55 grams! 😨",Ruoyreh
1087,2014-03-31 09:37:13+00:00,450567481602867201,Mtcheeewh they shld do something abt d value of Naira RT@TheNationNews,biolaamu
1088,2014-03-31 06:37:14+00:00,450522189557923840,Big S/O to the classy and hardworking girls out there who know the value of 1 naira. They exist and are out there and on twitter sef.,EarthenwareJ
1089,2014-03-31 06:34:24+00:00,450521475515441153,"When last was that? No be naira o""@ibreakdrules: but will lose value. RT @_mrzedd Friends may come and go but £200 is always be £200""",OlayinkaOnawola
1090,2014-03-28 16:37:45+00:00,449586147250176000,"5. Before the IBB years of failed bank decree, a Naira had more value to a dollar. Today a dollar equals N160 &amp; more in the black market.",abubakar47i
1091,2014-03-27 21:19:35+00:00,449294686977802241,"Meanwhile money is also being spent to ""defend the naira"" but it's still falling in value",HL_Blue
1092,2014-03-27 15:16:40+00:00,449203357316812800,@dupekilla @African_Markets yes now! When we don't have oil the Naira had more value than pounds by 100%,keduski
1093,2014-03-27 08:51:45+00:00,449106488905465856,"Image is everything ""@Emmysiasia: Nigerians are very funny. The way we cherish freshly minted naira notes, like it adds a kobo to its value.",aguhjay
1094,2014-03-27 08:46:28+00:00,449105157734035456,"Nigerians are very funny. The way we cherish freshly minted naira notes, like it adds a kobo to its value...",ECOnuoha
1095,2014-03-26 13:59:07+00:00,448821451668606976,…flight plus an increase in local investments was part of what led to the rise in Naira value. That's part of why Sanusi was fighting a …,ScarTissue101
1096,2014-03-26 09:49:07+00:00,448758537137954816,"(H) CAPACITY BUILDING
(I) ECONOMIC DEVELOPMENT
(J) VALUE OF NAIRA
(K) FIGHT AGAINST CORRUPTION
(L) YOUTH EMPOWERMENT
(M) POWER SUPPLY",Nasirnuhu
1097,2014-03-25 20:48:36+00:00,448562111846035456,When you know your worth you don't chase people you replace them.. Not Pride its # SELF VALUE #.. ...,Tee_Naira
1098,2014-03-25 17:34:43+00:00,448513322577850368,"Value for every Naira. Fully serviced and furnished business incubation space. @boxofficeng, Proudly Nigerian! http://t.co/6MDbmvoIVU",boxofficehubng
1099,2014-03-25 16:03:08+00:00,448490275951091712,U CAN BET ON THE OUTCOME OF THE GAME AND GET EQUALL VALUE FOR UR MONEY ON NAIRA http://t.co/JsLg4rxrZl,hotsolo27
1100,2014-03-24 23:16:55+00:00,448237051175919616,@Naira_TVD i saw this today and was wonder what your thoughts on it were.. I value your TVD opinion!:) http://t.co/gy0tohMvIX,tvdniandelena_
1101,2014-03-24 19:42:51+00:00,448183180659814403,@raziakkhan The Naira has lost 50% of its value against the greenback in 8years fueled by demand for imported goods.,ootelloo
1102,2014-03-24 18:46:23+00:00,448168969393176576,"I Own My Respect To Does Who Value Me, I Believe In Does Who Stand For Me. ""+ I believe My SURU will LERE",Tee_Naira
1103,2014-03-24 11:53:36+00:00,448065089489612800,Now I know the value of a naira 💰,RaffyMelanez
1104,2014-03-24 11:01:59+00:00,448052097213542400,"""@omojuwa: The value of the naira to a dollar is artificially around N170/dollar but in reality, it could be as bad as N250/dollar""...Sad",NUHU
1105,2014-03-24 10:57:44+00:00,448051031406944257,"“@omojuwa: The value of the naira to a dollar is artificially around N170/dollar but in reality, it could be as bad as N250/dollar”",faithmight
1106,2014-03-24 10:43:20+00:00,448047405939048449,"The value of the naira to a dollar is artificially around N170/dollar but in reality, it could be as bad as N250/dollar",Omojuwa
1107,2014-03-24 08:34:35+00:00,448015003170664448,"With an import dependent economy, d value of d naira falls, cost of import rises and local production  declines leading to  unemployment",akinbadejohnson
1108,2014-03-22 23:28:18+00:00,447515140498657280,"K""@Ashaka_m: ""@sireedu: Oboy this laptop ba3 dey go down like naira value"" sell buy NIPP nah""",sireedu
1109,2014-03-22 23:19:14+00:00,447512859598422016,"""@sireedu: Oboy this laptop ba3 dey go down like naira value"" sell buy NIPP nah",Ashaka_m
1110,2014-03-22 23:16:35+00:00,447512191831654400,Oboy this laptop ba3 dey go down like naira value,sireedu
1111,2014-03-21 21:50:48+00:00,447128214520213504,"@TunjiAndrews has been dashed, if this was done 100 naira airtime would have been sold for 110 which is more than the face value of the card",Ait360
1112,2014-03-21 12:56:41+00:00,446993801677381632,"Lol RT @girlish_lava Oh you prefer Zimbabwean dollar?""@9ja_Ninja: Ikr ""@Sir_Yinkz: Naira is Value-less""""",nawegovernment
1113,2014-03-20 13:34:44+00:00,446640988887732224,@TunjiAndrews Can we guess-timate the Naira value?,boasonbusiness
1114,2014-03-20 13:27:51+00:00,446639254224252928,"Lol...Dtz ok... Ryt behind u""@Nchurjames: Low value currencies..we on a dollar mode mate RT @Cwendee: I'm only tryna get d Randz nd d Naira""",Cwendee
1115,2014-03-20 13:19:43+00:00,446637209786269696,Low value currencies..we on a dollar mode mate RT @Cwendee: I'm only tryna get d Randz nd d Naira,Nchurjames
1116,2014-03-20 11:26:00+00:00,446608589567057920,“@BusinessDayNg: Naira falls despite CBN’s intervention at RDAS http://t.co/JSSasqL8xr”single digit inflation value under serious threat,DemiAdewumi
1117,2014-03-20 08:39:48+00:00,446566764135321600,"they dont use that anymore ""@girlish_lava: Oh you prefer Zimbabwean dollar?""@9ja_Ninja: Ikr ""@Sir_Yinkz: Naira is Value-less""""""",WaleyA14
1118,2014-03-20 08:02:17+00:00,446557324736757760,"Lmao. ""@girlish_lava: Oh you prefer Zimbabwean dollar?""@9ja_Ninja: Ikr ""@Sir_Yinkz: Naira is Value-less""""""",TheAkindare
1119,2014-03-20 08:01:27+00:00,446557113498615808,"Yeah. “@girlish_lava: Oh you prefer Zimbabwean dollar?""@9ja_Ninja: Ikr ""@Sir_Yinkz: Naira is Value-less""""”",Sir_Yinkz
1120,2014-03-20 07:43:34+00:00,446552615413772288,Naira is Value-less,Sir_Yinkz
1121,2014-03-19 22:40:36+00:00,446415971280908288,The Naira be losing value yo... #thuggedout monetary analyst,TosinDean
1122,2014-03-19 15:39:28+00:00,446309989221949440,Naira has little/no value.,MrUduku
1123,2014-03-19 14:52:42+00:00,446298222253060096,"If only Naira could get back to the value it had in the 70s. I would use this my last N20 to buy chicken, pizza and beer.",HariboChief
1124,2014-03-19 08:57:37+00:00,446208860827942912,The subsidy removal would mean an automatic devaluation of the Naira. Everything becomes expensive. The money you saved loses value.,linusNoni
1125,2014-03-19 08:22:35+00:00,446200044782624768,"The subsidy removal would mean an automatic devaluation of the Naira.

everything go come become expensive.

The money you saved loses value",woleawosika
1126,2014-03-19 05:25:51+00:00,446155567418322944,"I was going to say something about this 'build a 150, 000 naira website for 50K'. But nevermind. Its not going to be of value anyways",JideLambo
1127,2014-03-18 21:20:20+00:00,446033385279217664,"“@Nayrah4Life: ""@Callum_Murphy_: So done with Naira"" Switch to pounds then... much better value.” 😂👏",whatsthetee__
1128,2014-03-18 21:18:47+00:00,446032996421103616,"""@Callum_Murphy_: So done with Naira"" Switch to pounds then... much better value.",Naira_Nez
1129,2014-03-18 16:57:49+00:00,445967318384795649,Analysts canvass greater role for markets in determining Naira value http://t.co/Z2gL2CdWzn,Saharaspyreport
1130,2014-03-18 13:16:40+00:00,445911668011569152,"Analysts canvass greater role for markets in determining Naira value

The Central Bank of Nigeria’s success at... http://t.co/8fXhXgFCpl",9ja_money
1131,2014-03-18 06:41:54+00:00,445812318568316928,..found out- Analysts canvass greater role for markets in determining Naira value http://t.co/qj9VClntnS ...#Nigeria,fec_ng
1132,2014-03-18 01:48:24+00:00,445738458267406336,Analysts canvass greater role for markets in determining Naira value http://t.co/hZwhSFuX79 ...#Nigeria,alarinka_agbaye
1133,2014-03-18 01:16:03+00:00,445730317190459393,Analysts canvass greater role for markets in determining Naira value http://t.co/AimaZSyVSj,BusinessDayNg
1134,2014-03-18 01:15:44+00:00,445730239017013249,Analysts canvass greater role for markets in determining Naira value http://t.co/RciEQ7G3RK,BusinessDayNg
1135,2014-03-17 18:55:00+00:00,445634421161750528,Any1 is bera dan Gej..wat was d value of d naira durin Abacha's regime?RT @Casey_IX: @coolfrancess so you ... http://t.co/5I62BqRBiH,coolfrancess
1136,2014-03-17 15:37:59+00:00,445584843498205184,"Will take my chance with u Jare, it ends with u ""@shadduy: Mehn wot nex naw? ""@EmmyObike: I have fallen much more than the value of Naira",EmmyObike
1137,2014-03-17 15:22:54+00:00,445581045019078656,"I have fallen much more than the value of Naira, no bride ☹@Fact: Scientists say that you'll fall in love seven times before getting married",EmmyObike
1138,2014-03-17 13:34:11+00:00,445553684811108352,@IntegrityPortal Really? Was it really due to SLS's reputation that the naira's value fell? Question loaded with bias #IntegrityNG @omojuwa,stanleyazuakola
1139,2014-03-17 11:50:20+00:00,445527553001152512,"Blood is being shed, no power, no fuel, naira has no value, poverty's at its peak etc... Reasons to make us act on our ""No, We Are Tired""",peero007
1140,2014-03-17 08:49:34+00:00,445482059793203200,"Cedi no get value,naira all d way""@Questionnier: Nigeria or Ghana (Money)? #QnA""",emequeen
1141,2014-03-17 08:09:39+00:00,445472015135555585,Ladies and gentle men..if ur X wins 10million naira in who wants to be a millionaire..find the value of X,judexnams
1142,2014-03-16 13:19:25+00:00,445187584525094913,All thanks to _____ “@MuneeyTeejay The naira keeps losing its value day by day :-(”,sir_deeda
1143,2014-03-16 13:09:34+00:00,445185102138855424,The naira keeps losing its value day by day :-(,MuneeyTeejay
1144,2014-03-16 11:54:33+00:00,445166226957144064,This👉“@Ms_KhloeRita: Naira has no value 😔”,kingchibby
1145,2014-03-16 11:49:58+00:00,445165070386221056,Naira has no value 😔,Ms_KhloeRita
1146,2014-03-16 11:48:12+00:00,445164625479606272,"""@Von_Grim: @fynsake @eggheader @bimbo_cash @madejibo you cant blame GEJ for the value of the Naira.""Really??? Oya blame me na",madejibo
1147,2014-03-16 11:27:37+00:00,445159447279980544,@fynsake @eggheader @bimbo_cash @madejibo you cant blame GEJ for the value of the Naira.,Von_Grim
1148,2014-03-15 19:23:35+00:00,444916838557044737,how will they steal my stuff from my bag on an international flight? Canon HD Camera Gone! 3 Gold Chains Gone ! value over one million naira,Waconzy
1149,2014-03-14 13:26:13+00:00,444464516555104257,@airtel_care. Why is the BB data value in naira when u use *123*9# as opposed to MB?,mrredsammie
1150,2014-03-14 12:58:04+00:00,444457431880712192,@airtel_care why is the bb value in naira? And not in MB?,mrredsammie
1151,2014-03-14 11:25:30+00:00,444434136779206656,Sliding Stocks: Value of listed stocks on Nigerian bourse fell 208billion naira on Thursday as global markets react to Ukraine's crisis.,boasonbusiness
1152,2014-03-13 22:58:34+00:00,444246165832630272,"I'll b one of them sorry""@chibykedeh: Even if the Dollar, pounds and Naira are the same value, many Nigerians would still leave dis country""",OluuAkinduro
1153,2014-03-13 22:47:16+00:00,444243324426539008,"Even if the Dollar, pounds and Naira are the same value, many Nigerians would still leave dis country",chibykedeh
1154,2014-03-13 20:21:17+00:00,444206586483843072,"Oh Dear..... You hate Monreal so much to value him @ 100 Naira? ""@R1chierichguner
@dosinclair: Monreal .That's about how much he is worth""",DoSinclair
1155,2014-03-13 18:18:47+00:00,444175755673894912,Naira aint got value! *sighs*,Retrogodammed
1156,2014-03-13 16:59:28+00:00,444155795522207744,people should bother to plot a graph and check the value of external reserves at last devaluation of Naira. @NOIweala No imminent danger,BJCares
1157,2014-03-13 09:15:00+00:00,444038911250403328,"Kinda explains the Value of the Naira,Worthless. ""@THEOJNR_: A Thousand Naira And A Dream.""",The_Hemsley
1158,2014-03-11 20:11:54+00:00,443479446100922369,Leson learnt no mata how neat a 50 naira is its value can never exceed a dirty 1000 naira @Jahfas. @jt_warrior. @2faceidibia @AkposWarriboy,Iamyungtizzy
1159,2014-03-11 17:15:11+00:00,443434975518814208,41. i. Let your child get a job. Nothing teaches about the value of a Naira as fast as working for it. #finlit #gmw2014 #eaddagmw2014,gbonjute
1160,2014-03-10 15:19:41+00:00,443043519759130625,"Udontmeanit ""@Michgboxy: GHc has more value than Naira tho RT @Pesi_: That's How Much In Naira? N5.00? ""@kwakuNyan: GHc50.00 for petrol.",UNCUJAY
1161,2014-03-10 15:16:01+00:00,443042598932865024,"GHc has more value than Naira tho RT @PesinPikin_: That's How Much In Naira? N5.00? ""@kwakuNyan: GHc50.00 for petrol.... Tweeaakia""",Michgboxy
1162,2014-03-10 12:04:29+00:00,442994398989938688,What have I done? Is it any fault of mine that the Naira has no value? Pls Answers are needed.,phazzysmith
1163,2014-03-09 20:35:50+00:00,442760693180157952,"Naira nuh african currency? Wats the value ? ""@Questionnier: If given 10million naira, would you venture into petrol business at the moment?",Sugahcoatedcruf
1164,2014-03-08 08:56:45+00:00,442222377494413312,@CoolFMPH no mo crude oil in d country &amp; to add it gravity is acting on d value of Naira 2 d dollar &amp; its falling fast #bullseyefuelscarcity,iamAWATT
1165,2014-03-07 14:24:00+00:00,441942346200907777,The Real Value of the Dollar to the Naira is best seen at the Black Market.,Sir_Yinkz
1166,2014-03-07 13:51:25+00:00,441934142977363968,"E se ooh RT @OccupyNaija: For your Kids' Fun Stuffs, Follow @KINKIDDIES to get value for your every Naira ... http://t.co/JmG1czMYEg",habukia
1167,2014-03-07 13:09:14+00:00,441923530247380992,@stopcorruption1 @obongg what's wrong with the value of the Naira and how those it relate to a better standard of living in the 70's/80's?,LEOBLASTY
1168,2014-03-07 13:03:47+00:00,441922158944845825,"@obongg @LEOBLASTY Thank u for being very objective. Security was perfect, the value of Naira was better, food was affordable etc.",stopcorruption1
1169,2014-03-07 12:50:51+00:00,441918903028310016,"For your Kids' Fun Stuffs, Follow @KINKIDDIES to get value for your every Naira spent.. You can add us on BB 7BA819F1 OR 24CBA50A Thanks!!!",OmoGbajaBiamila
1170,2014-03-07 11:01:47+00:00,441891455398068224,"!""@Kofti_B: Amean. LoL. RT @kroksy1 Masters children be complaining about the value of Naira to Pounds. LASU still dey oh.""",dacosta321
1171,2014-03-07 10:16:58+00:00,441880176117706752,Masters children be complaining about the value of Naira to Pounds. LASU still dey oh.,kroksy1
1172,2014-03-07 06:21:56+00:00,441821029036732416,Is anyone following the Naira value? It is at its strongest just in two weeks!! Food for thought.,theayogeorge
1173,2014-03-06 22:06:16+00:00,441696290922303488,I'm sad RT @NN4MD1: Our Naira gaining value ★★,IAm__TipsY
1174,2014-03-06 21:59:30+00:00,441694587971964928,Our Naira gaining value ★★,NN4MD1
1175,2014-03-06 13:35:48+00:00,441567825875206144,"Person wey no know d value of 20 naira can never be a Nigerian policeman. Farouk lawan (2010)

#youngvigor",TheRealCourage
1176,2014-03-06 08:44:27+00:00,441494505435701248,The Naira has no value or whatsoever,pankomane
1177,2014-03-06 06:18:45+00:00,441457838997909504,"So I just finished reading the article I started 2 days ago, explaining how the NNPC's activities put pressure on the naira value",HL_Blue
1178,2014-03-05 12:54:25+00:00,441195025868001281,@ElJefe__ @SheriphSkills bullshit. There's an internationallly accepted value for the naira now. That's why you can use ur naira MasterCard…,ScarTissue101
1179,2014-03-05 12:42:56+00:00,441192133203361792,@ElJefe__ @SheriphSkills …in Naira. Zimbabwe is an example of what can go wrong when you peg the value of your money n think it shields you…,ScarTissue101
1180,2014-03-05 09:35:36+00:00,441144989650006016,"""@MagnifiKent_: Oh Naira, where is your value?""",Dicksondvniel
1181,2014-03-05 09:34:32+00:00,441144720077504512,"Oh Naira, where is your value?",MagnifiKent_
1182,2014-03-04 19:16:40+00:00,440928834268172289,Loool.its well RT @West_A4: @Ope0lu no be dem destroy the value of d naira?? Like leeches on to the next 1! Lolzzz,OpeoIuwa
1183,2014-03-04 19:05:57+00:00,440926135648804864,@Ope0lu no be dem destroy the value of d naira?? Like leeches on to the next 1! Lolzzz,bbprincewill
1184,2014-03-04 07:04:45+00:00,440744638316814336,"You value what God created for 200 Naira, how much are you worth.? Pls stop trending Dumb hashtag. U still my guy  @its_konani",Phrezzz
1185,2014-03-04 06:44:51+00:00,440739632872177664,"@Ekoonibajeooo enlighten pls, pls don't tell me about d value of the naira.",Diji_O
1186,2014-03-04 05:25:33+00:00,440719676226547712,"CBN defends naira with $6.4bn in eight weeks: In a bid to prevent the naira’s value from crashing, the Central... http://t.co/LTXOjFQTco",mesirano55
1187,2014-03-04 05:25:22+00:00,440719629598457856,"CBN defends naira with $6.4bn in eight weeks: In a bid to prevent the naira’s value from crashing, the Central... http://t.co/7CzxJt0vJO",AfricaNewsPress
1188,2014-03-04 05:15:04+00:00,440717038517235713,@NigeriaNewsdesk how much naira did they defend with 6.4billion dollars or are they just defending without justifiable naira value?,AAsanyaolu
